{"schema_version":"1.0","lineage_id":"aaaaaaaaaaaaaaaaaaaaaaaaaaaaaaaaaaaaaaaaaaaaaaaaaaaaaaaaaaaaaaaa","status":"pass","policy":"m1-4a2-prompt-neutrality-v1","protocol_ref":{"path":"prompt-development/protocol.json","sha256":"bbbbbbbbbbbbbbbbbbbbbbbbbbbbbbbbbbbbbbbbbbbbbbbbbbbbbbbbbbbbbbbb"},"prompt_refs":{"initial":{"path":"prompt-development/versions/v0/initial.md","sha256":"cccccccccccccccccccccccccccccccccccccccccccccccccccccccccccccccc"},"repair":{"path":"prompt-development/versions/v0/repair.md","sha256":"dddddddddddddddddddddddddddddddddddddddddddddddddddddddddddddddd"}},"input_refs":{"planning_index":{"path":"planning_index.json","sha256":"eeeeeeeeeeeeeeeeeeeeeeeeeeeeeeeeeeeeeeeeeeeeeeeeeeeeeeeeeeeeeeee"},"delivery_constraints":{"path":"delivery_constraints.json","sha256":"ffffffffffffffffffffffffffffffffffffffffffffffffffffffffffffffff"},"config":{"path":"prompt-development/config.json","sha256":"1111111111111111111111111111111111111111111111111111111111111111"},"context_limits":{"path":"prompt-development/context_limits.json","sha256":"2222222222222222222222222222222222222222222222222222222222222222"}}}
